{
  "schemaVersion": 1,
  "id": "aeroframe",
  "version": "1.0.0",
  "name": "AeroFrame",
  "description": "A mission-ready storefront for drone, robotics, and low-altitude technology brands.",
  "compatibility": { "cmsSchema": 1, "releaseSchema": 1 },
  "models": [
    {
      "key": "product", "label": "Products", "description": "Catalog products", "singleEntry": false,
      "fields": [
        { "key": "title", "label": "Title", "type": "STRING", "required": true, "array": false },
        { "key": "slug", "label": "Slug", "type": "STRING", "required": true, "array": false },
        { "key": "price", "label": "Price", "type": "NUMBER", "required": true, "array": false },
        { "key": "description", "label": "Description", "type": "STRING", "required": false, "array": false },
        { "key": "images", "label": "Images", "type": "MEDIA", "required": false, "array": true },
        { "key": "sku", "label": "SKU", "type": "STRING", "required": false, "array": false }
      ]
    },
    {
      "key": "collection", "label": "Collections", "description": "Product collections", "singleEntry": false,
      "fields": [
        { "key": "title", "label": "Title", "type": "STRING", "required": true, "array": false },
        { "key": "slug", "label": "Slug", "type": "STRING", "required": true, "array": false },
        { "key": "description", "label": "Description", "type": "STRING", "required": false, "array": false },
        { "key": "cover", "label": "Cover", "type": "MEDIA", "required": false, "array": false },
        { "key": "products", "label": "Products", "type": "ENTRY_POINTER", "required": false, "array": true, "referenceModel": "product" }
      ]
    },
    {
      "key": "home", "label": "Home page", "description": "Homepage content", "singleEntry": true,
      "fields": [
        { "key": "title", "label": "Title", "type": "STRING", "required": true, "array": false },
        { "key": "slug", "label": "Slug", "type": "STRING", "required": true, "array": false },
        { "key": "headline", "label": "Headline", "type": "STRING", "required": true, "array": false },
        { "key": "intro", "label": "Introduction", "type": "STRING", "required": false, "array": false },
        { "key": "heroImage", "label": "Hero image", "type": "MEDIA", "required": false, "array": false },
        { "key": "featuredCollections", "label": "Featured collections", "type": "ENTRY_POINTER", "required": false, "array": true, "referenceModel": "collection" },
        { "key": "featuredProducts", "label": "Featured products", "type": "ENTRY_POINTER", "required": false, "array": true, "referenceModel": "product" }
      ]
    },
    {
      "key": "content-page", "label": "Pages", "description": "About, shipping and policy pages", "singleEntry": false,
      "fields": [
        { "key": "title", "label": "Title", "type": "STRING", "required": true, "array": false },
        { "key": "slug", "label": "Slug", "type": "STRING", "required": true, "array": false },
        { "key": "summary", "label": "Summary", "type": "STRING", "required": false, "array": false },
        { "key": "cover", "label": "Cover", "type": "MEDIA", "required": false, "array": false },
        { "key": "body", "label": "Body", "type": "RICH_TEXT", "required": false, "array": false },
        { "key": "seoDescription", "label": "SEO description", "type": "STRING", "required": false, "array": false }
      ]
    },
    {
      "key": "site-settings", "label": "Site settings", "description": "Shared brand and navigation", "singleEntry": true,
      "fields": [
        { "key": "title", "label": "Title", "type": "STRING", "required": true, "array": false },
        { "key": "slug", "label": "Slug", "type": "STRING", "required": true, "array": false },
        { "key": "brandName", "label": "Brand name", "type": "STRING", "required": true, "array": false },
        { "key": "logo", "label": "Logo", "type": "MEDIA", "required": false, "array": false },
        { "key": "announcement", "label": "Announcement", "type": "STRING", "required": false, "array": false },
        { "key": "contactEmail", "label": "Contact email", "type": "STRING", "required": false, "array": false },
        { "key": "navigationPages", "label": "Navigation pages", "type": "ENTRY_POINTER", "required": false, "array": true, "referenceModel": "content-page" }
      ]
    }
  ],
  "pages": [
    { "key": "home", "title": "Home", "path": "/", "modelKey": "home", "layout": "home" },
    { "key": "collections", "title": "Collections", "path": "/collections", "modelKey": "collection", "layout": "collection-list" },
    { "key": "product", "title": "Product detail", "path": "/products/:slug", "modelKey": "product", "layout": "product-detail" },
    { "key": "content", "title": "Content page", "path": "/pages/:slug", "modelKey": "content-page", "layout": "content-page" }
  ],
  "assets": [
    { "path": "assets/hero.png", "checksum": "47b7b9fcbb62b73e149302a001cd661eaa23469aedfb249a56a9a29d026c6ca4", "mimeType": "image/png" }
  ]
}
